{
  "core_paths": [
    "services/vinhomes-api/src/<package lõi do CN-0 đặt tên>/",
    "agent-coordination/src/ (trừ vinhomes/ và agent_eval/)",
    "app/src/features/<thư mục giao diện lõi do CN-0 đặt tên>/",
    "shared/python/",
    "shared/contracts/v2/"
  ],
  "pack_paths": [
    "<thư mục gói Vinhomes do PH-2 đặt>/",
    "agent-coordination/src/vinhomes/",
    "services/vinhomes-api/src/vinhomes_api/",
    "app/src/features/vinhomes-operations/",
    "resident-app/"
  ],
  "banned_terms": [
    "vinhomes",
    "ocean park",
    "sapphire",
    "ban quản lý",
    "bql",
    "cư dân",
    "căn hộ",
    "tòa nhà"
  ],
  "allowed_until_after_demo": [
    "VINHOMES_*",
    "vh_*",
    "vinhomes_api",
    "vinhomes-api"
  ],
  "known_violations": []
}
